<?xml version="1.0" encoding="UTF-8"?>
<xs:schema xmlns:xs="http://www.w3.org/2001/XMLSchema" elementFormDefault="qualified"
    targetNamespace="http://www.vakcinisoni.com/ImmunizationReport"
    xmlns:vx="http://www.vakcinisoni.com/ImmunizationReport">

    <xs:element name="immunizationReport">
        <xs:complexType>
            <xs:sequence>
                <xs:element name="startDate">
                    <xs:complexType>
                        <xs:simpleContent>
                            <xs:extension base="xs:date">
                                <xs:attribute fixed="pred:startDate" name="property"/>
                            </xs:extension>
                        </xs:simpleContent>
                    </xs:complexType>
                </xs:element>
                <xs:element name="finishDate">
                    <xs:complexType>
                        <xs:simpleContent>
                            <xs:extension base="xs:date">
                                <xs:attribute fixed="pred:finishDate" name="property"/>
                            </xs:extension>
                        </xs:simpleContent>
                    </xs:complexType>
                </xs:element>
                <xs:element name="immunizationRequests">
                    <xs:complexType>
                        <xs:simpleContent>
                            <xs:extension base="xs:positiveInteger">
                                <xs:attribute fixed="pred:immunizationRequests" name="property"/>
                            </xs:extension>
                        </xs:simpleContent>
                    </xs:complexType>
                </xs:element>
                <xs:element name="certificateRequests">
                    <xs:complexType>
                        <xs:simpleContent>
                            <xs:extension base="xs:positiveInteger">
                                <xs:attribute fixed="pred:certificateRequests" name="property"/>
                            </xs:extension>
                        </xs:simpleContent>
                    </xs:complexType>
                </xs:element>
                <xs:element name="certificatesIssued">
                    <xs:complexType>
                        <xs:simpleContent>
                            <xs:extension base="xs:positiveInteger">
                                <xs:attribute fixed="pred:certificatesIssued" name="property"/>
                            </xs:extension>
                        </xs:simpleContent>
                    </xs:complexType>
                </xs:element>
                <xs:element name="vaccinesTaken">
                    <xs:simpleType>
                        <xs:restriction base="xs:int">
                            <xs:minInclusive value="0"/>
                            <xs:maxInclusive value="2147483647"/>
                        </xs:restriction>
                    </xs:simpleType>
                </xs:element>
                <xs:element name="firstTimeVaccineTaken">
                    <xs:simpleType>
                        <xs:restriction base="xs:int">
                            <xs:minInclusive value="0"/>
                        </xs:restriction>
                    </xs:simpleType>
                </xs:element>
                <xs:element name="manufacturers">
                    <xs:complexType>
                        <xs:sequence>
                            <xs:element maxOccurs="unbounded" minOccurs="1" name="manufacturer"
                                type="vx:manufacturer"/>
                        </xs:sequence>
                    </xs:complexType>
                </xs:element>
                <xs:element name="reportDate" type="xs:date"/>
            </xs:sequence>
            <xs:attribute name="about" type="xs:string"/>
        </xs:complexType>
    </xs:element>
    <xs:complexType name="manufacturer">
        <xs:sequence>
            <xs:element name="name" type="xs:string"/>
            <xs:element name="numberOfVaccines">
                <xs:simpleType>
                    <xs:restriction base="xs:int">
                        <xs:minInclusive value="0"/>
                    </xs:restriction>
                </xs:simpleType>
            </xs:element>
        </xs:sequence>
    </xs:complexType>
</xs:schema>
