<?xml version="1.0" encoding="UTF-8"?>
<immunizationReport xmlns="http://www.vakcinisoni.com"
    xmlns:xsi="http://www.w3.org/2001/XMLSchema-instance"
    xsi:schemaLocation="http://www.vakcinisoni.com ImmunizationReport.xsd">
    <startDate>2021-12-01</startDate>
    <finishDate>2021-12-31</finishDate>
    <immunizationRequests>2758</immunizationRequests>
    <certificateRequests>453</certificateRequests>
    <certificatesIssued>428</certificatesIssued>
    <vaccinesTaken>3225</vaccinesTaken>
    <firstTimeVaccineTaken>1789</firstTimeVaccineTaken>
    <manufacturers>
        <manufacturer>
            <name>Pfizer BioNTech</name>
            <numberOfVaccines>1625</numberOfVaccines>
        </manufacturer>
        <manufacturer>
            <name>Sinopharm</name>
            <numberOfVaccines>1100</numberOfVaccines>
        </manufacturer>
        <manufacturer>
            <name>Sputnik V</name>
            <numberOfVaccines>356</numberOfVaccines>
        </manufacturer>
    </manufacturers>
    <reportDate>2021-12-07</reportDate>
</immunizationReport>